{
  "$schema": "http://json-schema.org/draft-07/schema#",
  "$id": "https://web3sec.local/schema/bounty_policy.schema.json",
  "title": "WebSec Bounty Policy",
  "description": "Machine-readable encoding of a bug bounty program's rules: scope, exclusions, known issues, severity floors, PoC requirements. The final gate answers 'is this submission-ready against THIS program', not merely 'is this a real bug'.",
  "type": "object",
  "additionalProperties": false,
  "required": ["program", "program_url", "chains", "scope", "severity_rules", "poc_requirements"],
  "properties": {
    "program":     { "type": "string", "minLength": 2 },
    "program_url": { "type": "string" },
    "platform":    { "enum": ["immunefi", "hackenproof", "cantina", "code4rena", "sherlock", "direct", "other"] },
    "chains":      { "type": "array", "items": { "type": "string" }, "minItems": 1 },
    "asset_weight_usd": { "type": ["number", "null"], "minimum": 0, "description": "total assets in scope, for impact calibration" },

    "scope": {
      "type": "array",
      "minItems": 1,
      "items": {
        "type": "object",
        "additionalProperties": false,
        "required": ["target"],
        "properties": {
          "target":     { "type": "string", "description": "contract name, path prefix, or 0x-address" },
          "kind":       { "enum": ["contract", "path", "address", "chain", "behavior"] },
          "max_severity": { "enum": ["critical", "high", "medium", "low"] }
        }
      }
    },

    "exclusions": {
      "type": "array",
      "description": "known issues and excluded behaviors — each is a tripwire for the final gate",
      "items": {
        "type": "object",
        "additionalProperties": false,
        "required": ["pattern"],
        "properties": {
          "pattern":   { "type": "string", "description": "substring/keyword matched against finding class, title and description" },
          "kind":      { "enum": ["known-issue", "excluded-behavior", "excluded-component", "intended-behavior", "previous-report"] },
          "reference": { "type": "string", "description": "URL or note documenting the exclusion" },
          "case_sensitive": { "type": "boolean", "default": false }
        }
      }
    },
    "accepted_risks": {
      "type": "array",
      "description": "documented, program-accepted risks (IMPROVEMENTS A1): a matched finding is recorded (finding.bounty.accepted_risk), stays visible and counted, but is not submittable as a vulnerability; a same-pattern exclusion is suppressed (the accepted risk is the narrower, more specific rule). min_severity caps the acceptance: at that severity and above the acceptance does not apply.",
      "items": {
        "type": "object",
        "additionalProperties": false,
        "required": ["pattern"],
        "properties": {
          "pattern":        { "type": "string", "description": "substring/keyword matched against finding class, title and description (same semantics as exclusions)" },
          "kind":           { "enum": ["known-issue", "design-decision", "mitigated", "accepted-risk"] },
          "reference":      { "type": "string", "description": "URL or note documenting the acceptance" },
          "reference_url":  { "type": "string", "minLength": 8, "description": "the program page / scope clause the exclusion cites — G7 hygiene: a policy claim without a reference is still valid but the report stamps it (no reference cited)" },
          "note":           { "type": "string" },
          "min_severity":   { "enum": ["low", "medium", "high", "critical"], "description": "the acceptance stops applying at this severity and above — the gate then demands real handling" },
          "case_sensitive": { "type": "boolean", "default": false }
        }
      }
    },

    "submission_budget": {
      "type": "object",
      "additionalProperties": false,
      "description": "operator precision budget (IMPROVEMENTS A3): caps the report's top-K acceptance table and lets the ranking key be flipped from acceptance likelihood to severity band. Absent = uncapped, ranked by acceptance.",
      "properties": {
        "max_findings": { "type": "integer", "minimum": 0, "description": "0 (default) = uncapped (top 10 rendered); >0 = cap the top-K table at this many findings, with a note line when the cap is reached" },
        "rank_by":      { "enum": ["acceptance", "severity"], "description": "default acceptance: acceptance score descending (disqualified last); severity: band order (critical > high > medium > low > informational), then validated score descending" }
      }
    },

    "acceptance_priors": { "type": "boolean", "default": false, "description": "G3 calibrated acceptance prior (wPrior): when true, the acceptance score adds the finding's class base rate over the eval store's adjudicated outcomes (bounded ±0.5, thin classes fall back to silent zero). Absent or false = today's score, byte-for-byte." },

    "severity_rules": {
      "type": "array",
      "minItems": 1,
      "items": {
        "type": "object",
        "additionalProperties": false,
        "required": ["severity", "match"],
        "properties": {
          "severity": { "enum": ["critical", "high", "medium", "low"] },
          "match": {
            "type": "object",
            "additionalProperties": false,
            "properties": {
              "bug_classes": { "type": "array", "items": { "type": "string" } },
              "min_extractable_usd": { "type": ["number", "null"], "minimum": 0 },
              "blast_radius": { "type": "array", "items": { "enum": ["single-user", "subset-of-users", "all-users", "protocol-solvency", "bridge-canonical"] } },
              "require_invariant_violation": { "type": "boolean" }
            }
          }
        }
      }
    },

    "poc_requirements": {
      "type": "object",
      "additionalProperties": false,
      "required": ["min_evidence_level", "require_fork_repro"],
      "properties": {
        "min_evidence_level": { "enum": ["E3", "E4", "E5", "E6", "E7"] },
        "require_fork_repro": { "type": "boolean" },
        "require_economic_quantification": { "type": "boolean" },
        "require_exploit_contract": { "type": "boolean" },
        "min_extractable_usd": { "type": ["number", "null"], "minimum": 0 },
        "patch_clause": {
          "enum": ["verification", "prose", "none"],
          "description": "what the program wants for a fix. `verification` (default when absent): a patch that provably blocks the fork PoC and all 3 boundary mutations (check12 as it always was). `prose`: a written recommendation on the finding (verification.recommendation, >= 40 chars) clears the clause and the boundary mutations become an advisory line, not a blocker. `none`: the program does not ask for a fix, so nothing is required of the finding. The boundary-mutation record stays in every mode — only its gate authority changes."
        }
      }
    },

    "reporting": {
      "type": "object",
      "additionalProperties": false,
      "properties": {
        "contact": { "type": "string" },
        "required_fields": { "type": "array", "items": { "type": "string" } },
        "notes":  { "type": "string" }
      }
    }
  }
}
