{
  "program": "Golden Vault",
  "program_url": "https://example.invalid/golden-vault",
  "platform": "direct",
  "chains": ["ethereum"],
  "asset_weight_usd": 25000000,
  "scope": [
    {"target": "Vault", "kind": "contract", "max_severity": "critical"},
    {"target": "Other", "kind": "contract", "max_severity": "high"}
  ],
  "exclusions": [
    {"pattern": "centralization risk accepted",
     "kind": "intended-behavior",
     "reference": "https://example.invalid/golden-vault/known-issues"}
  ],
  "severity_rules": [
    {"severity": "critical",
     "match": {"bug_classes": ["access-control", "share-price-inflation", "logic-error"],
               "min_extractable_usd": 100000}},
    {"severity": "medium", "match": {"bug_classes": ["dos-griefing"]}}
  ],
  "poc_requirements": {
    "min_evidence_level": "E4",
    "require_fork_repro": false
  }
}
